{
  "schemaVersion": "1.0.0",
  "manifestId": "manifest_BTRMANIFEST01",
  "runId": "mig_PORTFOLIO0001",
  "sourceId": "btrieve",
  "hostname": "legacy-btrieve-db",
  "inventoryDigest": "sha256:3030303030303030303030303030303030303030303030303030303030303030",
  "recordSets": [{"name": "ARCUS", "recordCount": 80, "byteCount": 15360, "schemaDigest": "sha256:3333333333333333333333333333333333333333333333333333333333333333"}],
  "observedAt": "2026-08-26T14:00:12Z"
}
