{
  "schemaVersion": "1.0.0",
  "manifestId": "manifest_MAXMANIFEST01",
  "runId": "mig_PORTFOLIO0001",
  "sourceId": "maxdb",
  "hostname": "legacy-maxdb",
  "inventoryDigest": "sha256:2020202020202020202020202020202020202020202020202020202020202020",
  "recordSets": [{"name": "KNA1", "recordCount": 120, "byteCount": 30720, "schemaDigest": "sha256:2222222222222222222222222222222222222222222222222222222222222222"}],
  "observedAt": "2026-08-26T14:00:11Z"
}
